<?xml version="1.0" encoding="utf-8"?>
<?xml-stylesheet type="text/xsl" href="../charmreview-xmlns.xsl"?>
<!DOCTYPE charmlist PUBLIC "-//TA//DTD Charms 1.6//EN"
"../charms.dtd">
<charmlist xmlns="http://anathema.sourceforge.net/charms">
     <!-- Terrestrial Hero Style - Scroll of the Monk Add-on charms -->
     <charm id="Terrestrial.DisarmingStrikePrana" exalt="Dragon-Blooded" group="TerrestrialHeroStyle">
          <prerequisite>
               <trait id="MartialArts" value="4" />
               <essence value="3" />
               <charmReference id="Terrestrial.BecomeHammer" />
          </prerequisite>
          <cost>
               <essence cost="3" />
               <willpower cost="1" />
          </cost>
          <duration duration="Instant" />
          <charmtype type="Simple" />
          <charmAttribute attribute="Terrestrial" />
          <charmAttribute attribute="Exclusive" />
          <charmAttribute attribute="Combo-OK" visualize="true" />
          <source source="ScrollMonk" />
     </charm>
     <charm id="Terrestrial.BondsUnbreakableIceTechnique" exalt="Dragon-Blooded" group="TerrestrialHeroStyle">
          <prerequisite>
               <trait id="MartialArts" value="3" />
               <essence value="2" />
               <charmReference id="Terrestrial.RiptideMethod" />
          </prerequisite>
          <cost>
               <essence cost="3" />
               <willpower cost="1" />
          </cost>
          <duration amount="Essence" unit="action" />
          <charmtype type="Supplemental" />
          <charmAttribute attribute="Terrestrial" />
          <charmAttribute attribute="Exclusive" />
          <charmAttribute attribute="Combo-OK" visualize="true" />
          <charmAttribute attribute="Obvious" visualize="true" />
          <charmAttribute attribute="Touch" visualize="true" />
          <source source="ScrollMonk" />
     </charm>
     <charm id="Terrestrial.CrushingGlacierPrana" exalt="Dragon-Blooded" group="TerrestrialHeroStyle">
          <prerequisite>
               <trait id="MartialArts" value="5" />
               <essence value="4" />
               <charmReference id="Terrestrial.BondsUnbreakableIceTechnique" />
          </prerequisite>
          <cost>
               <essence cost="10" />
               <willpower cost="1" />
          </cost>
          <duration amount="Essence" unit="action" />
          <charmtype type="Supplemental" />
          <charmAttribute attribute="Terrestrial" />
          <charmAttribute attribute="Exclusive" />
          <charmAttribute attribute="Combo-OK" visualize="true" />
          <charmAttribute attribute="Obvious" visualize="true" />
          <charmAttribute attribute="Touch" visualize="true" />
          <source source="ScrollMonk" />
     </charm>
     <charm id="Terrestrial.SmashingTidalWaveTechnique" exalt="Dragon-Blooded" group="TerrestrialHeroStyle">
          <prerequisite>
               <trait id="MartialArts" value="5" />
               <essence value="4" />
               <charmReference id="Terrestrial.CrushingGlacierPrana" />
          </prerequisite>
          <cost>
               <essence cost="3" text="+3 per additional target" />
               <willpower cost="1" />
          </cost>
          <duration amount="MartialArts" unit="action" />
          <charmtype type="Supplemental" />
          <charmAttribute attribute="Terrestrial" />
          <charmAttribute attribute="Exclusive" />
          <charmAttribute attribute="Obvious" visualize="true" />
          <source source="ScrollMonk" />
     </charm>
     <charm id="Terrestrial.SlipperyEscapeMethod" exalt="Dragon-Blooded" group="TerrestrialHeroStyle">
          <prerequisite>
               <trait id="MartialArts" value="3" />
               <essence value="2" />
               <charmReference id="Terrestrial.DrowningEmbrace" />
          </prerequisite>
          <cost>
               <essence cost="1" text="per 2 dice" />
          </cost>
          <duration duration="Instant" />
          <charmtype type="Supplemental" />
          <charmAttribute attribute="Terrestrial" />
          <charmAttribute attribute="Exclusive" />
          <charmAttribute attribute="Combo-OK" visualize="true" />
          <charmAttribute attribute="Obvious" visualize="true" />
          <source source="ScrollMonk" />
     </charm>
     <charm id="Terrestrial.SwiftStreamPrana" exalt="Dragon-Blooded" group="TerrestrialHeroStyle">
          <prerequisite>
               <trait id="MartialArts" value="4" />
               <essence value="3" />
               <charmReference id="Terrestrial.SlipperyEscapeMethod" />
          </prerequisite>
          <cost>
               <essence cost="2" />
          </cost>
          <duration duration="Instant" />
          <charmtype type="Reflexive">
               <special primaryStep="2" />
          </charmtype>
          <charmAttribute attribute="Terrestrial" />
          <charmAttribute attribute="Exclusive" />
          <charmAttribute attribute="Combo-OK" visualize="true" />
          <charmAttribute attribute="Obvious" visualize="true" />
          <source source="ScrollMonk" />
     </charm>
</charmlist>
