<?xml version="1.0" encoding="utf-8"?>
<?xml-stylesheet type="text/xsl" href="../charmreview-xmlns.xsl"?>
<!DOCTYPE charmlist PUBLIC "-//TA//DTD Charms 1.5.1//EN"
"../charms.dtd">
<!--

    charisma.xml - XML charm data for Anathema Plug-ins.
    Copyright (C) 2010  Scott Olson (scott.d.olson@comcast.net)
	Copyright (C) 2010  Paul Adams (pauladams@hotmail.com)

    This program is free software; you can redistribute it and/or modify
    it under the terms of the GNU General Public License as published by
    the Free Software Foundation; either version 2 of the License, or
    (at your option) any later version.

    This program is distributed in the hope that it will be useful,
    but WITHOUT ANY WARRANTY; without even the implied warranty of
    MERCHANTABILITY or FITNESS FOR A PARTICULAR PURPOSE.  See the
    GNU General Public License for more details.

    You should have received a copy of the GNU General Public License
    along with this program; if not, write to the Free Software
    Foundation, Inc., 59 Temple Place, Suite 330, Boston, MA  02111-1307  USA

-->
<charmlist xmlns="http://anathema.sourceforge.net/charms">
	<!-- Charisma Charms -->
	<charm id="Lunar.FeralSmileTactic" exalt="Lunar" group="Interaction">
		<prerequisite>
			<trait id="Charisma" value="3" />
			<essence value="3" />
			<charmAttributeRequirement attribute="ExcellencyCharisma" count="1" />
		</prerequisite>
		<cost>
			<essence cost="6" />
			<willpower cost="1" />
		</cost>
		<duration amount="1" unit="scene" />
		<charmtype type="Simple">
			<special speed="5" defense="-1" />
		</charmtype>
		<charmAttribute attribute="Combo-OK" visualize="true" />
		<charmAttribute attribute="Compulsion" visualize="true" />
		<charmAttribute attribute="Emotion" visualize="true" />
		<charmAttribute attribute="Social" visualize="true" />
		<source source="InkMonkeys" />
	</charm>
	<charm id="Lunar.LionsVoiceCommand" exalt="Lunar" group="MilitaryUnit">
		<prerequisite>
			<trait id="Charisma" value="4" />
			<essence value="3" />
			<charmAttributeRequirement attribute="ExcellencyCharisma" count="1" />
		</prerequisite>
		<cost>
			<essence cost="5" />
		</cost>
		<duration amount="1" unit="scene" />
		<charmtype type="Reflexive" />
		<charmAttribute attribute="Combo-OK" visualize="true" />
		<charmAttribute attribute="Obvious" visualize="true" />
		<charmAttribute attribute="War" visualize="true" />
		<source source="InkMonkeys" />
	</charm>
	<charm id="Lunar.SilverLunarResolutionCharisma" exalt="Lunar" group="EssenceRegaining">
		<prerequisite>
			<trait id="Charisma" value="4" />
			<essence value="3" />
		</prerequisite>
		<cost />
		<duration duration="Permanent" />
		<charmtype type="Permanent" />
		<!-- NOTE:  "Mirror" - Lunar/Stamina & Lunar/Charisma -->
		<repurchases limitingTrait="Essence"/>
		<charmAttribute attribute="Native" visualize="true" />
		<charmAttribute attribute="NotAlienLearnable" />
		<source source="InkMonkeys" />
	</charm>
	<charm id="Lunar.SilverAndGoldSpanTheHeavens" exalt="Lunar" group="Virtue">
		<prerequisite>
			<trait id="Charisma" value="3" />
			<essence value="3" />
               <charmReference id="Lunar.SacredGuardianRenewal" />
		</prerequisite>
		<cost>
			<essence cost="1" text="per dot of Bond"/>
		</cost>
		<duration duration="Indefinite" />
		<charmtype type="Simple" />
		<charmAttribute attribute="Native" visualize="true" />
		<charmAttribute attribute="NotAlienLearnable" />
		<charmAttribute attribute="Touch" visualize="true" />
		<source source="InkMonkeys" />
	</charm>
</charmlist>

