<?xml version="1.0" encoding="utf-8"?>
<?xml-stylesheet type="text/xsl" href="../charmreview-xmlns.xsl"?>
<!DOCTYPE charmlist PUBLIC "-//TA//DTD Charms 1.6//EN"
"../charms.dtd">
<!--

    DarkMessiah.xml - XML charm data for Anathema plug-ins.
    Copyright (C) 2009  Scott D. Olson (scott.d.olson@comcast.net)

    This program is free software; you can redistribute it and/or modify
    it under the terms of the GNU General Public License as published by
    the Free Software Foundation; either version 2 of the License, or
    (at your option) any later version.

    This program is distributed in the hope that it will be useful,
    but WITHOUT ANY WARRANTY; without even the implied warranty of
    MERCHANTABILITY or FITNESS FOR A PARTICULAR PURPOSE.  See the
    GNU General Public License for more details.

    You should have received a copy of the GNU General Public License
    along with this program; if not, write to the Free Software
    Foundation, Inc., 59 Temple Place, Suite 330, Boston, MA  02111-1307  USA

-->
<charmlist xmlns="http://anathema.sourceforge.net/charms">
     <!-- Solar Hero Style - Hundredfold Paths of Enlightenment add-ons-->
     <charm id="Solar.ArmorShatteringStrike3" exalt="Solar" group="SolarHeroStyle">
          <prerequisite>
               <trait id="MartialArts" value="5" />
               <essence value="3" />
               <charmReference id="Solar.SolarHeroForm" />
          </prerequisite>
          <cost>
               <essence cost="4" />
          </cost>
          <duration duration="Instant" />
          <charmtype type="Supplemental" />
          <charmAttribute attribute="Celestial" />
          <charmAttribute attribute="Combo-OK" visualize="true" />
		<charmAttribute attribute="Mirror" visualize="true" />
		<!-- NOTE:  Abyssal Mirror - Iron Maiden's Embrace -->
          <charmAttribute attribute="Obvious" visualize="true" />
          <charmAttribute attribute="Shaping" visualize="true" />
          <source source="GloriesUCS" />
     </charm>
     <charm id="Solar.ArmorShatteringStrike5" exalt="Solar" group="SolarHeroStyle">
          <prerequisite>
               <trait id="MartialArts" value="5" />
               <essence value="5" />
               <charmReference id="Solar.ArmorShatteringStrike3" />
          </prerequisite>
          <cost>
               <essence cost="4" />
          </cost>
          <duration duration="Instant" />
          <charmtype type="Supplemental" />
          <charmAttribute attribute="Celestial" />
          <charmAttribute attribute="Combo-OK" visualize="true" />
			<!-- NOTE:  Abyssal Mirror - Iron Maiden's Embrace -->
          <charmAttribute attribute="Obvious" visualize="true" />
          <charmAttribute attribute="Shaping" visualize="true" />
          <source source="GloriesUCS" />
     </charm>
     <charm id="Solar.IronTalonTechnique6" exalt="Solar" group="SolarHeroStyle">
          <prerequisite>
               <trait id="MartialArts" value="6" />
               <essence value="6" />
               <charmReference id="Solar.DragonCoilTechnique" />
          </prerequisite>
          <cost>
               <essence cost="5" />
               <willpower cost="1" />
          </cost>
          <duration duration="Instant" />
          <charmtype type="Reflexive">
          	<special primaryStep="9" />
          </charmtype>
          <charmAttribute attribute="Celestial" />
          <charmAttribute attribute="Combo-OK" visualize="true" />
          <charmAttribute attribute="Mirror" visualize="true" />
          <charmAttribute attribute="Obvious" visualize="true" />
          <source source="GloriesUCS" />
     </charm>
     <charm id="Solar.IronTalonTechnique9" exalt="Solar" group="SolarHeroStyle">
          <prerequisite>
               <trait id="MartialArts" value="9" />
               <essence value="9" />
               <charmReference id="Solar.IronTalonTechnique6" />
          </prerequisite>
          <cost>
               <essence cost="5" />
               <willpower cost="1" />
          </cost>
          <duration duration="Instant" />
          <charmtype type="Reflexive">
          	<special primaryStep="9" />
          </charmtype>
          <charmAttribute attribute="Celestial" />
          <charmAttribute attribute="Combo-OK" visualize="true" />
          <charmAttribute attribute="Mirror" visualize="true" />
          <charmAttribute attribute="Obvious" visualize="true" />
          <source source="GloriesUCS" />
     </charm>
</charmlist>
