<?xml version="1.0" encoding="utf-8"?>
<?xml-stylesheet type="text/xsl" href="../../charmreview-xmlns.xsl"?>
<!DOCTYPE charmlist PUBLIC "-//TA//DTD Charms 1.6//EN"
"../../charms.dtd">
<!--

    survival.xml - XML charm data for Anathema plug-ins.
    Copyright (C) 2008  Paul R. Adams (pauladams@hotmail.com)

    This program is free software; you can redistribute it and/or modify
    it under the terms of the GNU General Public License as published by
    the Free Software Foundation; either version 2 of the License, or
    (at your option) any later version.

    This program is distributed in the hope that it will be useful,
    but WITHOUT ANY WARRANTY; without even the implied warranty of
    MERCHANTABILITY or FITNESS FOR A PARTICULAR PURPOSE.  See the
    GNU General Public License for more details.

    You should have received a copy of the GNU General Public License
    along with this program; if not, write to the Free Software
    Foundation, Inc., 59 Temple Place, Suite 330, Boston, MA  02111-1307  USA

-->
<charmlist xmlns="http://anathema.sourceforge.net/charms">
     <!-- Survival -->
     <charm id="Solar.GuidingLightShinesOn" exalt="Solar" group="Survival">
          <prerequisite>
               <trait id="Survival" value="5" />
               <essence value="4" />
               <charmReference id="Solar.TracklessRegionNavigation" />
          </prerequisite>
          <cost>
               <essence cost="5" />
          </cost>
          <duration duration="Indefinite" />
          <charmtype type="Reflexive" />
          <charmAttribute attribute="Combo-OK" visualize="true" />
          <charmAttribute attribute="Obvious" visualize="true" />
			<source source="LordsOfCreation" />
          <source source="ScrollErrata" />
     </charm>
     <charm id="Solar.LifeSustainingShelterPreparation" exalt="Solar" group="Survival">
          <prerequisite>
               <trait id="Survival" value="5" />
               <essence value="5" />
               <charmReference id="Solar.Food-GatheringExercise" />
               <charmReference id="Solar.Hardship-SurvivingMendicantSpirit" />
          </prerequisite>
          <cost>
               <essence cost="10" />
               <willpower cost="1" />
          </cost>
          <duration duration="Indefinite" />
          <charmtype type="Simple">
			<special turntype="DramaticAction" />
		</charmtype>
          <charmAttribute attribute="Combo-OK" visualize="true" />
          <charmAttribute attribute="Shaping" visualize="true" />
			<source source="LordsOfCreation" />
          <source source="ScrollErrata" />
     </charm>
     <charm id="Solar.GodKingBenevolence" exalt="Solar" group="Survival">
          <prerequisite>
               <trait id="Survival" value="7" />
               <essence value="7" />
               <charmReference id="Solar.City-MovingSecrets" />
				<charmReference id="Solar.Element-ResistingPrana" />
          </prerequisite>
          <cost />
          <duration duration="Permanent" />
          <charmtype type="Permanent" />
		<charmAttribute attribute="Obvious" visualize="true" />
			<source source="LordsOfCreation" />
          <source source="ScrollErrata" />
     </charm>
</charmlist>
