<?xml version="1.0" encoding="utf-8"?>
<?xml-stylesheet type="text/xsl" href="../charmreview-xmlns.xsl"?>
<!DOCTYPE charmlist PUBLIC "-//TA//DTD Charms 1.5.1//EN"
"../charms.dtd">
<!--

    Adorjan.xml - XML charm data for Anathema Plug-ins.
    Copyright (C) 2011  Sean C. Mattox (sean.mattox@gmail.com)

    This program is free software; you can redistribute it and/or modify
    it under the terms of the GNU General Public License as published by
    the Free Software Foundation; either version 2 of the License, or
    (at your option) any later version.

    This program is distributed in the hope that it will be useful,
    but WITHOUT ANY WARRANTY; without even the implied warranty of
    MERCHANTABILITY or FITNESS FOR A PARTICULAR PURPOSE.  See the
    GNU General Public License for more details.

    You should have received a copy of the GNU General Public License
    along with this program; if not, write to the Free Software
    Foundation, Inc., 59 Temple Place, Suite 330, Boston, MA  02111-1307  USA

-->
<charmlist xmlns="http://anathema.sourceforge.net/charms">    	 	 
	 <charm id="Infernal.FireflyArrowheadGrip" exalt="Infernal" group="Wind">
          <prerequisite>
               <trait id="Adorjan" value="0" />
               <essence value="3" />	   
               <charmReference id="Infernal.KalmankasGrace"/>
          </prerequisite>
           <cost> 
               <essence cost="-" text="(5m)" />    
          </cost>
          <duration duration="Permanent" />
          <charmtype type="Permanent" />
          <charmAttribute attribute="Obvious" visualize="true" />
          <source source="BrokenWingedCrane" />
     </charm>  	 	 
	 <charm id="Infernal.BeauteousCarnageIncentive" exalt="Infernal" group="Wind">
          <prerequisite>
               <trait id="Adorjan" value="0" />
               <essence value="3" />	   
               <charmReference id="Infernal.MurderisMeat"/>
          </prerequisite>
           <cost />
          <duration duration="Permanent" />
          <charmtype type="Permanent" />
          <charmAttribute attribute="Native" visualize="true" />
          <source source="BrokenWingedCrane" />
     </charm> 	 
	 <charm id="Infernal.CrimsonWindRibbons" exalt="Infernal" group="Wind">
          <prerequisite>
               <trait id="Adorjan" value="0" />
               <essence value="3" />	   
               <charmReference id="Infernal.SelfasCycloneStance"/>
          </prerequisite>
           <cost />
          <duration duration="Permanent" />
          <charmtype type="Permanent" />
          <source source="BrokenWingedCrane" />
     </charm>
	 <charm id="Infernal.SplinteredGaleShintai" exalt="Infernal" group="Wind">
          <prerequisite>
               <trait id="Adorjan" value="0" />
               <essence value="3" />	   
               <charmReference id="Infernal.SelfasCycloneStance"/>
          </prerequisite>
           <cost> 
               <essence cost="10" />    
               <willpower cost="1" />     
               <health cost="1" type="Aggravated" />  
          </cost>
          <duration duration="Indefinite" />
          <charmtype type="Simple" />
		  <special speed="7" />
          <charmAttribute attribute="Obvious" visualize="true" />
          <charmAttribute attribute="Sorcerous" visualize="true" />
          <charmAttribute attribute="Stackable" visualize="true" />
          <source source="BrokenWingedCrane" />
     </charm> 
	 <charm id="Infernal.Sky-VaultingSurge" exalt="Infernal" group="Unimpeded">
          <prerequisite>
               <trait id="Adorjan" value="0" />
               <essence value="2" />	   
               <charmReference id="Infernal.UnimpededPerfectionofExertion"/>
          </prerequisite>
           <cost> 
               <essence cost="2" />    
          </cost>
          <duration duration="UntilJump" />
          <charmtype type="Reflexive" />
          <charmAttribute attribute="Combo-OK" visualize="true" />
          <charmAttribute attribute="Obvious" visualize="true" />
          <charmAttribute attribute="Velocity" visualize="true" />
          <source source="BrokenWingedCrane" />
     </charm> 	
	 <charm id="Infernal.FondRemembranceofAdrian" exalt="Infernal" group="Sacred">
          <prerequisite>
               <trait id="Adorjan" value="0" />
               <essence value="2" />	   
               <charmReference id="Infernal.SacredKamillasInhalation"/>
          </prerequisite>
           <cost> 
               <essence cost="6" />    
          </cost>
          <duration duration="Indefinite" />
          <charmtype type="Reflexive" />
		  <special primaryStep="2" />
          <charmAttribute attribute="Combo-OK" visualize="true" />
          <charmAttribute attribute="Counterattack" visualize="true" />
          <charmAttribute attribute="Obvious" visualize="true" />
          <charmAttribute attribute="Stackable" visualize="true" />
          <source source="BrokenWingedCrane" />
     </charm> 	
	 <charm id="Infernal.TheftasRelease" exalt="Infernal" group="Freedom">
          <prerequisite>
               <trait id="Adorjan" value="0" />
               <essence value="2" />	   
               <charmReference id="Infernal.Wind-BornStride"/>
               <charmReference id="Infernal.FreedomLetsGo"/>
          </prerequisite>
           <cost> 
               <essence cost="3" />  
               <willpower cost="1" />    
          </cost>
          <duration duration="Instant" />
          <charmtype type="Supplemental" />
          <charmAttribute attribute="Combo-OK" visualize="true" />
          <charmAttribute attribute="Illusion" visualize="true" />
          <source source="BrokenWingedCrane" />
     </charm> 	
	 <charm id="Infernal.BrokenSoulWisdom" exalt="Infernal" group="Freedom">
          <prerequisite>
               <trait id="Adorjan" value="0" />
               <essence value="3" />	   
               <charmReference id="Infernal.TragicLoveAmusement"/>
          </prerequisite>
           <cost> 
               <essence cost="10" />  
               <willpower cost="1" />    
          </cost>
          <duration duration="Instant" />
          <charmtype type="Simple" />
          <charmAttribute attribute="Combo-OK" visualize="true" />
          <charmAttribute attribute="Desecration" visualize="true" />
          <charmAttribute attribute="Shaping" visualize="true" />
          <charmAttribute attribute="Touch" visualize="true" />
          <source source="BrokenWingedCrane" />
     </charm> 
	 <charm id="Infernal.Wind-CarriedPassion" exalt="Infernal" group="Freedom">
          <prerequisite>
               <trait id="Adorjan" value="0" />
               <essence value="3" />	   
               <charmReference id="Infernal.TragicLoveAmusement"/>
          </prerequisite>
           <cost />
          <duration duration="Permanent" />
          <charmtype type="Permanent" />
          <source source="BrokenWingedCrane" />
     </charm> 
	 <charm id="Infernal.GiftofSilence" exalt="Infernal" group="Sacred">
          <prerequisite>
               <trait id="Adorjan" value="0" />
               <essence value="3" />	   
               <charmReference id="Infernal.EloquenceinUnspokenWords"/>
          </prerequisite>
           <cost />
          <duration duration="Permanent" />
          <charmtype type="Permanent" />
          <charmAttribute attribute="Touch" visualize="true" />
          <source source="BrokenWingedCrane" />
     </charm> 
</charmlist>
