<?xml version="1.0" encoding="utf-8"?>
<?xml-stylesheet type="text/xsl" href="../charmreview-xmlns.xsl"?>
<!DOCTYPE charmlist PUBLIC "-//TA//DTD Charms 1.5.1//EN"
"../charms.dtd">
<!--

    bureaucracy.xml - XML charm data for Anathema Plug-ins.
    Copyright (C) 2007  Paul R. Adams (pauladams@hotmail.com)

    This program is free software; you can redistribute it and/or modify
    it under the terms of the GNU General Public License as published by
    the Free Software Foundation; either version 2 of the License, or
    (at your option) any later version.

    This program is distributed in the hope that it will be useful,
    but WITHOUT ANY WARRANTY; without even the implied warranty of
    MERCHANTABILITY or FITNESS FOR A PARTICULAR PURPOSE.  See the
    GNU General Public License for more details.

    You should have received a copy of the GNU General Public License
    along with this program; if not, write to the Free Software
    Foundation, Inc., 59 Temple Place, Suite 330, Boston, MA  02111-1307  USA

-->
<charmlist xmlns="http://anathema.sourceforge.net/charms">
     <!-- Bureaucracy -->
     <charm id="Sidereal.IcyHand" exalt="Sidereal" group="Bureaucracy">
          <prerequisite>
               <trait id="Bureaucracy" value="2" />
               <essence value="2" />
          </prerequisite>
          <cost>
               <essence cost="1" />
          </cost>
          <duration amount="5" unit="day" />
          <charmtype type="Simple" />
          <charmAttribute attribute="Combo-OK" visualize="true" />
          <charmAttribute attribute="Compulsion" visualize="true" />
          <charmAttribute attribute="Fate" visualize="true" />
          <charmAttribute attribute="Touch" visualize="true" />
          <source source="Sidereals2nd" />
     </charm>
     <charm id="Sidereal.TerminalSanction" exalt="Sidereal" group="Bureaucracy">
          <prerequisite>
               <trait id="Bureaucracy" value="4" />
               <essence value="3" />
               <charmReference id="Sidereal.IcyHand" />
          </prerequisite>
          <cost>
               <essence cost="8" />
               <willpower cost="1" />
          </cost>
          <duration amount="1" unit="scene" />
          <charmtype type="Simple" />
          <charmAttribute attribute="Combo-Basic" visualize="true" />
          <charmAttribute attribute="Maiden" visualize="true" />
          <charmAttribute attribute="Servitude" visualize="true" />
          <charmAttribute attribute="Virtue-Temperance" visualize="true" />
          <source source="Sidereals2nd" />
     </charm>
     <charm id="Sidereal.UnderlingInvisibilityPractice" exalt="Sidereal" group="Bureaucracy">
          <prerequisite>
               <trait id="Bureaucracy" value="3" />
               <essence value="2" />
          </prerequisite>
          <cost>
               <essence cost="4" />
          </cost>
          <duration duration="Indefinite" />
          <charmtype type="Simple" />
          <charmAttribute attribute="Illusion" visualize="true" />
          <source source="Sidereals2nd" />
     </charm>
     <charm id="Sidereal.ParalyzedMandarinInfliction" exalt="Sidereal" group="Bureaucracy">
          <prerequisite>
               <trait id="Bureaucracy" value="3" />
               <essence value="3" />
               <charmReference id="Sidereal.UnderlingInvisibilityPractice" />
          </prerequisite>
          <cost>
               <essence cost="5" />
          </cost>
          <duration duration="Indefinite" />
          <charmtype type="Simple" />
          <charmAttribute attribute="Combo-OK" visualize="true" />
          <charmAttribute attribute="Compulsion" visualize="true" />
          <source source="Sidereals2nd" />
     </charm>
     <charm id="Sidereal.EndDebate" exalt="Sidereal" group="Bureaucracy">
          <prerequisite>
               <trait id="Bureaucracy" value="5" />
               <essence value="3" />
               <charmReference id="Sidereal.ParalyzedMandarinInfliction" />
               <charmReference id="Sidereal.TerminalSanction" />
          </prerequisite>
          <cost>
               <essence cost="10" />
               <willpower cost="1" />
               <health cost="1" type="Lethal" />
          </cost>
          <duration duration="Instant" />
          <charmtype type="Simple" />
          <charmAttribute attribute="Combo-OK" visualize="true" />
          <charmAttribute attribute="Compulsion" visualize="true" />
          <charmAttribute attribute="Obvious" visualize="true" />
          <charmAttribute attribute="PrayerStrip" visualize="true" />
          <source source="Sidereals2nd" />
     </charm>
</charmlist>
