<?xml version="1.0" encoding="utf-8"?>
<?xml-stylesheet type="text/xsl" href="../charmreview-xmlns.xsl"?>
<!DOCTYPE charmlist PUBLIC "-//TA//DTD Charms 1.5.1//EN"
"../charms.dtd">
<!--

    attackEnhancement.xml - XML charm data for Anathema Plug-ins.
    Copyright (C) 2007  Paul R. Adams (pauladams@hotmail.com)

    This program is free software; you can redistribute it and/or modify
    it under the terms of the GNU General Public License as published by
    the Free Software Foundation; either version 2 of the License, or
    (at your option) any later version.

    This program is distributed in the hope that it will be useful,
    but WITHOUT ANY WARRANTY; without even the implied warranty of
    MERCHANTABILITY or FITNESS FOR A PARTICULAR PURPOSE.  See the
    GNU General Public License for more details.

    You should have received a copy of the GNU General Public License
    along with this program; if not, write to the Free Software
    Foundation, Inc., 59 Temple Place, Suite 330, Boston, MA  02111-1307  USA

-->
<charmlist xmlns="http://anathema.sourceforge.net/charms">
     <!-- Attack Enhancement Charms -->
     <charm id="Lunar.WindWingsCarryTechnique" exalt="Lunar" group="AttackEnhancement">
          <prerequisite>
               <trait id="Strength" value="4" />
               <essence value="2" />
               <charmAttributeRequirement attribute="ExcellencyStrength" count="1" />
          </prerequisite>
          <cost>
               <essence cost="1" text="or 2m per range increase" />
          </cost>
          <duration duration="Instant" />
          <charmtype type="Supplemental" />
          <charmAttribute attribute="Combo-OK" visualize="true" />
          <source source="Lunars2nd" />
     </charm>
     <charm id="Lunar.AgitationOfTheSwarmTechnique" exalt="Lunar" group="AttackEnhancement">
          <prerequisite>
               <trait id="Strength" value="4" />
               <essence value="2" />
               <charmAttributeRequirement attribute="ExcellencyStrength" count="1" />
          </prerequisite>
          <cost>
               <essence cost="2" />
          </cost>
          <duration duration="Instant" />
          <charmtype type="Supplemental" />
          <charmAttribute attribute="Combo-OK" visualize="true" />
          <source source="Lunars2nd" />
     </charm>
     <charm id="Lunar.FerociousBitingTooth" exalt="Lunar" group="AttackEnhancement">
          <prerequisite>
               <trait id="Strength" value="4" />
               <essence value="2" />
               <charmAttributeRequirement attribute="ExcellencyStrength" count="1" />
          </prerequisite>
          <cost>
               <essence cost="4" />
          </cost>
          <duration duration="Instant" />
          <charmtype type="Supplemental" />
          <charmAttribute attribute="Combo-OK" visualize="true" />
          <source source="Lunars2nd" />
     </charm>
     <charm id="Lunar.LightningStrokeAttackStr" exalt="Lunar" group="AttackEnhancement">
          <prerequisite>
               <trait id="Strength" value="5" />
               <essence value="4" />
               <charmReference id="Lunar.AgitationOfTheSwarmTechnique" />
               <charmReference id="Lunar.FerociousBitingTooth" />
          </prerequisite>
          <cost>
               <essence cost="7" />
          </cost>
          <duration duration="Instant" />
          <charmtype type="Supplemental" />
			<!-- NOTE:  Lunar/Dexterity "Mirror" - Lightning Stroke Attack -->
          <charmAttribute attribute="Combo-OK" visualize="true" />
          <charmAttribute attribute="Obvious" visualize="true" />
          <source source="Lunars2nd" />
     </charm>
</charmlist>
