<?xml version="1.0" encoding="UTF-8"?>
<!--<?xml-stylesheet type="text/xsl" href="../charmreview.xsl"?>
<!DOCTYPE charmlist SYSTEM "../charms.dtd">-->

<!--

AirDragon.xml © Paul R. Adams, 2007

This XML is licensed under the Creative Commons Attribution-Share Alike 3.0 United States 
License. To view a copy of this license, visit http://creativecommons.org/licenses/by-sa/3.0/us/ 
or send a letter to Creative Commons, 543 Howard Street, 5th Floor, San Francisco, California, 
94105, USA.

-->
<charmlist>
  <!-- Air Dragon Style -->
  <charm id="Celestial.AirDragonsSight" exalt="Dragon-Blooded" group="AirDragonStyle">
    <prerequisite>
      <trait id="MartialArts" value="2"/>
      <essence value="1"/>
    </prerequisite>
    <cost>
        <essence cost="3"/>
    </cost>
    <duration amount="1" unit="scene"/>
    <charmtype type="Simple"/>
    <charmAttribute attribute="Celestial"/>
    <charmAttribute attribute="Combo-Basic" visualize="true"/>
    <source source="DragonBlooded2nd"/>
  </charm>
  <charm id="Celestial.WindDragonSpeed" exalt="Dragon-Blooded" group="AirDragonStyle">
    <prerequisite>
      <trait id="MartialArts" value="2"/>
      <essence value="2"/>
      <charmReference id="Celestial.AirDragonsSight"/>
    </prerequisite>
    <cost>
        <essence cost="2"/>
    </cost>
    <duration duration="Instant"/>
    <charmtype type="Reflexive">
    	<special primaryStep="1"/>
    </charmtype>
    <charmAttribute attribute="Celestial"/>
    <charmAttribute attribute="Combo-OK" visualize="true"/>
    <charmAttribute attribute="Leader" visualize="true"/>
    <source source="DragonBlooded2nd"/>
  </charm>
  <charm id="Celestial.BreathSeizingTechnique" exalt="Dragon-Blooded" group="AirDragonStyle">
    <prerequisite>
      <trait id="MartialArts" value="3"/>
      <essence value="1"/>
      <charmReference id="Celestial.AirDragonsSight"/>
    </prerequisite>
    <cost>
        <essence cost="4"/>
    </cost>
    <duration amount="MartialArts" unit="action"/>
    <charmtype type="Simple"/>
    <charmAttribute attribute="Celestial"/>
    <charmAttribute attribute="Crippling" visualize="true"/>
    <charmAttribute attribute="Combo-OK" visualize="true"/>
    <charmAttribute attribute="Stackable" visualize="true"/>
    <source source="DragonBlooded2nd"/>
  </charm>
  <charm id="Celestial.ShroudingTheBodyAndMind" exalt="Dragon-Blooded" group="AirDragonStyle">
    <prerequisite>
      <trait id="MartialArts" value="3"/>
      <essence value="2"/>
      <charmReference id="Celestial.AirDragonsSight"/>
    </prerequisite>
    <cost>
        <essence cost="4"/>
    </cost>
    <duration amount="MartialArts" unit="action"/>
    <charmtype type="Simple">
    	<special speed="5" defense="-1"/>
    </charmtype>
    <charmAttribute attribute="Celestial"/>
    <charmAttribute attribute="Combo-Basic" visualize="true"/>
    <charmAttribute attribute="Obvious" visualize="true"/>
    <source source="DragonBlooded2nd"/>
  </charm>
  <charm id="Celestial.AirDragonForm" exalt="Dragon-Blooded" group="AirDragonStyle">
    <prerequisite>
      <trait id="MartialArts" value="4"/>
      <essence value="2"/>
      <charmReference id="Celestial.BreathSeizingTechnique"/>
      <charmReference id="Celestial.ShroudingTheBodyAndMind"/>
      <charmReference id="Celestial.WindDragonSpeed"/>
    </prerequisite>
    <cost>
        <essence cost="5"/>
    </cost>
    <duration amount="1" unit="scene"/>
    <charmtype type="Simple">
    	<special speed="5" defense="-1"/>
    </charmtype>
    <charmAttribute attribute="Celestial"/>
    <charmAttribute attribute="Form" visualize="true"/>
    <charmAttribute attribute="Leader" visualize="true"/>
    <source source="DragonBlooded2nd"/>
  </charm>
  <charm id="Celestial.TornadoOffenseTechnique" exalt="Dragon-Blooded" group="AirDragonStyle">
    <prerequisite>
      <trait id="MartialArts" value="4"/>
      <essence value="2"/>
      <charmReference id="Celestial.AirDragonForm"/>
    </prerequisite>
    <cost>
        <essence cost="3" text="per attack"/>
    </cost>
    <duration duration="Instant"/>
    <charmtype type="ExtraAction"/>
    <charmAttribute attribute="Celestial"/>
    <charmAttribute attribute="Combo-OK" visualize="true"/>
    <charmAttribute attribute="Obvious" visualize="true"/>
    <source source="DragonBlooded2nd"/>
  </charm>
  <charm id="Celestial.AvengingWindStrike" exalt="Dragon-Blooded" group="AirDragonStyle">
    <prerequisite>
      <trait id="MartialArts" value="5"/>
      <essence value="3"/>
      <charmReference id="Celestial.TornadoOffenseTechnique"/>
    </prerequisite>
    <cost>
        	<essence cost="3"/>
    </cost>
    <duration duration="Instant"/>
    <charmtype type="Supplemental"/>
    <charmAttribute attribute="Celestial"/>
    <charmAttribute attribute="Combo-OK" visualize="true"/>
    <charmAttribute attribute="Knockback" visualize="true"/>
    <charmAttribute attribute="Obvious" visualize="true"/>
    <source source="DragonBlooded2nd"/>
  </charm>
  <charm id="Celestial.WrathfulWindsManeuver" exalt="Dragon-Blooded" group="AirDragonStyle">
    <prerequisite>
      <trait id="MartialArts" value="5"/>
      <essence value="3"/>
      <charmReference id="Celestial.AvengingWindStrike"/>
    </prerequisite>
    <cost>
        <essence cost="4"/>
    </cost>
    <duration duration="Instant"/>
    <charmtype type="Simple"/>
    <charmAttribute attribute="Celestial"/>
    <charmAttribute attribute="Combo-Basic" visualize="true"/>
    <charmAttribute attribute="Crippling" visualize="true"/>
    <charmAttribute attribute="Obvious" visualize="true"/>
    <source source="DragonBlooded2nd"/>
  </charm>
  <charm id="Celestial.CloudTreadingMethod" exalt="Dragon-Blooded" group="AirDragonStyle">
  	<prerequisite>
  		<trait id="MartialArts" value="5"/>
  		<essence value="3"/>
  		<charmReference id="Celestial.AirDragonForm"/>
  	</prerequisite>
  	<cost>
  			<essence cost="3"/>
  	</cost>
  	<duration amount="MartialArts" unit="action"/>
  	<charmtype type="Reflexive"/>
  	<charmAttribute attribute="Celestial"/>
  	<charmAttribute attribute="Combo-OK" visualize="true"/>
  	<charmAttribute attribute="Obvious" visualize="true"/>
  	<source source="DragonBlooded2nd"/>
  </charm>
  <charm id="Celestial.ThunderclapKata" exalt="Dragon-Blooded" group="AirDragonStyle">
  	<prerequisite>
  		<trait id="MartialArts" value="5"/>
  		<essence value="3"/>
  		<charmReference id="Celestial.CloudTreadingMethod"/>
  	</prerequisite>
  	<cost>
  			<essence cost="5"/>
  	</cost>
  	<duration duration="Instant"/>
  	<charmtype type="Simple"/>
  	<charmAttribute attribute="Celestial"/>
  	<charmAttribute attribute="Combo-Basic" visualize="true"/>
        <charmAttribute attribute="Crippling" visualize="true"/>
  	<source source="DragonBlooded2nd"/>
  </charm>
  <charm id="Celestial.LightningStrikeStyle" exalt="Dragon-Blooded" group="AirDragonStyle">
  	<prerequisite>
  		<trait id="MartialArts" value="5"/>
  		<essence value="3"/>
  		<charmReference id="Celestial.ThunderclapKata"/>
  	</prerequisite>
  	<cost>
  			<essence cost="4"/>
  			<health cost="1"/>
  	</cost>
  	<duration amount="MartialArts" unit="action"/>
  	<charmtype type="Simple">
  		<special speed="4" defense="-1"/>
  	</charmtype>
  	<charmAttribute attribute="Celestial"/>
  	<charmAttribute attribute="Combo-OK" visualize="true"/>
        <charmAttribute attribute="Leader" visualize="true"/>
  	<charmAttribute attribute="Obvious" visualize="true"/>
  	<source source="DragonBlooded2nd"/>
  </charm>
  <charm id="Celestial.HurricaneCombatMethod" exalt="Dragon-Blooded" group="AirDragonStyle">
  	<prerequisite>
  		<trait id="MartialArts" value="5"/>
  		<essence value="4"/>
  		<charmReference id="Celestial.WrathfulWindsManeuver"/>
  		<charmReference id="Celestial.LightningStrikeStyle"/>
  	</prerequisite>
  	<cost>
  			<essence cost="10"/>
  			<willpower cost="1"/>
  			<health cost="1" type="Bashing" text="per action"/>
  	</cost>
  	<duration amount="MartialArts" unit="action"/>
  	<charmtype type="Reflexive"/>
  	<charmAttribute attribute="Celestial"/>
  	<charmAttribute attribute="Combo-OK" visualize="true"/>
  	<charmAttribute attribute="Obvious" visualize="true"/>
  	<source source="DragonBlooded2nd"/>
  </charm>
</charmlist>
