<?xml version="1.0" encoding="utf-8"?>
<?xml-stylesheet type="text/xsl" href="../charmreview-xmlns.xsl"?>
<!DOCTYPE charmlist PUBLIC "-//TA//DTD Charms 1.5.1//EN"
"../../charms.dtd">
<!--

    sail.xml - XML charm data for Anathema Plug-ins.
    Copyright (C) 2010 Scott D. Olson (scott.d.olson@comcast.net)

    This program is free software; you can redistribute it and/or modify
    it under the terms of the GNU General Public License as published by
    the Free Software Foundation; either version 2 of the License, or
    (at your option) any later version.

    This program is distributed in the hope that it will be useful,
    but WITHOUT ANY WARRANTY; without even the implied warranty of
    MERCHANTABILITY or FITNESS FOR A PARTICULAR PURPOSE.  See the
    GNU General Public License for more details.

    You should have received a copy of the GNU General Public License
    along with this program; if not, write to the Free Software
    Foundation, Inc., 59 Temple Place, Suite 330, Boston, MA  02111-1307  USA

-->
<charmlist xmlns="http://anathema.sourceforge.net/charms">
	<!-- Sail -->
	<charm id="Abyssal.FellCaptainsAdvantages" exalt="Abyssal" group="Sail">
	<prerequisite>
		<trait id="Sail" value="3" />
		<essence value="3" />
		<charmReference id="Abyssal.DarkWaterOdyssey" />
	</prerequisite>
	<cost />
	<duration duration="Permanent" />
	<charmtype type="Permanent" />
	<charmAttribute attribute="Mirror" visualize="true" />
	<!-- NOTE:  Solar Mirror - Immortal Captain's Advantages -->
	<charmAttribute attribute="Native" visualize="true" />
	<charmAttribute attribute="NotAlienLearnable" />
	<source source="InkMonkeys" />
	</charm>
	<charm id="Abyssal.TreacherousFlagDisplay" exalt="Solar" group="Sail">
		<prerequisite>
			<trait id="Sail" value="4" />
			<essence value="3" />
			<charmReference id="Abyssal.UnhallowedGhostShip" />
		</prerequisite>
		<cost>
			<essence cost="7" />
		</cost>
		<duration duration="Indefinite" />
		<charmtype type="Simple" />
		<charmAttribute attribute="Combo-OK" visualize="true" />
		<charmAttribute attribute="Illusion" visualize="true" />
		<charmAttribute attribute="Mirror" visualize="true" />
		<!-- NOTE:  Solar Mirror - Flag of All Nations Method -->
		<charmAttribute attribute="Obvious" visualize="true" />
		<source source="InkMonkeys" />
	</charm>
</charmlist>
